{
  "schema_version": "2.0.0",
  "likelihood_mode": "relative_weight",
  "simulation_mode": "qualitative",
  "assurance_tier": null,
  "simulation_id": "sim-example",
  "created_at": "2026-07-01T00:00:00Z",
  "status": "completed",
  "change_point": {
    "type": "factor_change",
    "target": "factor:example",
    "description": "Example present-day change point",
    "magnitude": 0.4,
    "time": "2026-07-01",
    "location": "global",
    "assumption_ref": "assumption:change-point"
  },
  "temporal_frame": {
    "mode": "prospective_intervention",
    "observation_cutoff": "2026-07-01",
    "simulation_start": "2026-07-01",
    "simulation_end": "2028-07-01",
    "future_projection": true,
    "calibration_strategy": "Check mechanisms against observed history up to the cutoff; rank post-cutoff alternatives with normalized relative weights that are not probabilities.",
    "monitoring_indicators": ["factor:example"]
  },
  "scope": {
    "horizon": "P24M",
    "domains": ["mixed"],
    "geographies": ["global"]
  },
  "execution": {
    "adaptive_scope": {
      "assessed": true,
      "overall_complexity": 0.0,
      "dimensions": {
        "temporal_span": 0.0,
        "domain_breadth": 0.0,
        "geographic_breadth": 0.0,
        "actor_density": 0.0,
        "causal_depth": 0.0,
        "evidence_uncertainty": 0.0,
        "stakes": 0.0
      },
      "rationale": "Minimal linked fixture used to validate the portable artifact contract.",
      "decomposition": {
        "subquestions": ["What changes after the intervention?"],
        "critical_paths": ["factor:example -> factor:example"],
        "research_waves_completed": 1
      }
    },
    "research_quality": "limited",
    "research_control": {
      "policy": "evidence-saturation",
      "sources_examined": 1,
      "saturation_reached": true,
      "consecutive_no_new_material_claims": 1,
      "stop_reason": "All fixture claims are covered and further sources would add no material information.",
      "unresolved_critical_gaps": [],
      "next_wave_queue": []
    },
    "d_research": {
      "status": "unavailable",
      "invoked": false
    },
    "subagents": {
      "status": "unavailable",
      "tool": null,
      "detection_method": "template smoke test",
      "fallback_reason": "No subagent runtime is available in the template fixture."
    },
    "repair_cycles_completed": 0,
    "checkpoints": {
      "initialized": true,
      "scope_assessed": true,
      "baseline_researched": true,
      "human_tracks_completed": true,
      "graph_built": true,
      "propagated": true,
      "branched": true,
      "validated": true
    }
  },
  "active_contexts": [],
  "assumptions": [
    {
      "id": "assumption:change-point",
      "statement": "The user-provided change point is treated as true inside the simulated world."
    }
  ],
  "artifact_paths": {
    "nodes": "nodes.json",
    "edges": "edges.json",
    "actors": "actors.json",
    "human_track_ledger": "human-track-ledger.jsonl",
    "evidence_map": "evidence-map.csv",
    "branch_ledger": "branch-ledger.json",
    "propagation_trace": "propagation-trace.jsonl",
    "validation_report": "validation-report.json",
    "final_report": "REPORT.md"
  }
}
